{
  "$schema": "https://json-schema.org/draft/2020-12/schema",
  "$id": "https://agent-orchestrator.dev/quality/schemas/review-meta.v1.schema.json",
  "title": "Quality Studio review metadata v1",
  "type": "object",
  "additionalProperties": false,
  "patternProperties": { "^x-[a-z0-9][a-z0-9.-]*$": true },
  "required": ["$schema", "schemaVersion", "unit", "reviewedAt", "kind", "reviewer", "reviewedHash", "subjectInputs", "reviewInputs", "grade", "summary", "aspects", "findings"],
  "properties": {
    "$schema": { "const": "https://agent-orchestrator.dev/quality/schemas/review-meta.v1.schema.json" },
    "schemaVersion": { "const": 1 },
    "unit": { "$ref": "#/$defs/unit" },
    "reviewedAt": { "type": "string", "format": "date-time", "pattern": "Z$" },
    "kind": { "enum": ["code", "security", "performance"] },
    "reviewer": { "$ref": "#/$defs/reviewer" },
    "reviewedHash": { "$ref": "#/$defs/subjectManifestHash" },
    "subjectInputs": { "type": "array", "minItems": 1, "uniqueItems": true, "items": { "$ref": "#/$defs/subjectInput" } },
    "reviewInputs": { "$ref": "#/$defs/reviewInputs" },
    "grade": { "$ref": "#/$defs/grade" },
    "summary": { "type": "string", "minLength": 1, "maxLength": 2000 },
    "aspects": { "type": "array", "minItems": 1, "items": { "$ref": "#/$defs/aspect" } },
    "findings": { "type": "array", "items": { "$ref": "#/$defs/finding" } },
    "aggregate": { "$ref": "#/$defs/aggregate" }
  },
  "allOf": [
    {
      "if": { "properties": { "unit": { "properties": { "level": { "enum": ["project", "module", "namespace"] } }, "required": ["level"] } } },
      "then": { "required": ["aggregate"] },
      "else": { "not": { "required": ["aggregate"] } }
    },
    {
      "if": { "properties": { "unit": { "properties": { "level": { "const": "function" } }, "required": ["level"] } } },
      "then": { "properties": { "unit": { "required": ["symbolId"] } } },
      "else": { "properties": { "unit": { "not": { "required": ["symbolId"] } } } }
    }
  ],
  "$defs": {
    "repoPath": { "type": "string", "minLength": 1, "pattern": "^(?!/)(?!.*(?:^|/)\\.\\.(?:/|$))[^\\\\]+$" },
    "sha256String": { "type": "string", "pattern": "^sha256:[a-f0-9]{64}$" },
    "subjectManifestHash": {
      "type": "object", "additionalProperties": false,
      "required": ["algorithm", "canonicalization", "value"],
      "properties": {
        "algorithm": { "const": "sha256" },
        "canonicalization": { "const": "quality-studio-subject-manifest-v1" },
        "value": { "type": "string", "pattern": "^[a-f0-9]{64}$" }
      }
    },
    "inputManifestHash": {
      "type": "object", "additionalProperties": false,
      "required": ["algorithm", "canonicalization", "value"],
      "properties": {
        "algorithm": { "const": "sha256" },
        "canonicalization": { "const": "quality-studio-review-inputs-v1" },
        "value": { "type": "string", "pattern": "^[a-f0-9]{64}$" }
      }
    },
    "unit": {
      "type": "object", "additionalProperties": false,
      "required": ["id", "adapter", "level", "path", "displayName"],
      "properties": {
        "id": { "type": "string", "pattern": "^qs-v1/(angular|dotnet)/(project|module|namespace|file|function)/[a-f0-9]{64}$" },
        "adapter": { "enum": ["angular", "dotnet"] },
        "level": { "enum": ["project", "module", "namespace", "file", "function"] },
        "path": { "$ref": "#/$defs/repoPath" },
        "displayName": { "type": "string", "minLength": 1, "maxLength": 500 },
        "symbolId": { "type": "string", "minLength": 1, "maxLength": 2000 }
      }
    },
    "reviewer": {
      "type": "object", "additionalProperties": false,
      "required": ["agent", "model"],
      "properties": {
        "agent": { "type": "string", "minLength": 1, "maxLength": 200 },
        "model": { "type": "string", "minLength": 1, "maxLength": 200 },
        "agentVersion": { "type": "string", "minLength": 1, "maxLength": 100 },
        "runId": { "type": "string", "minLength": 1, "maxLength": 200 }
      }
    },
    "subjectInput": {
      "type": "object", "additionalProperties": false,
      "required": ["path", "selector", "contentHash"],
      "properties": {
        "path": { "$ref": "#/$defs/repoPath" },
        "selector": { "oneOf": [
          { "const": "file" }, { "const": "aggregate-control" }, { "const": "aggregate-members" },
          { "type": "string", "pattern": "^symbol:(?:[A-Za-z0-9._~-]|%[A-F0-9]{2})+$", "maxLength": 2000 }
        ] },
        "contentHash": { "$ref": "#/$defs/sha256String" }
      }
    },
    "standardReference": {
      "type": "object", "additionalProperties": false,
      "required": ["id", "scope", "version", "contentHash"],
      "properties": {
        "id": { "type": "string", "pattern": "^[a-z0-9][a-z0-9._-]{1,127}$" },
        "scope": { "enum": ["built-in", "global", "project"] },
        "version": { "type": "string", "minLength": 1, "maxLength": 100 },
        "contentHash": { "$ref": "#/$defs/sha256String" }
      }
    },
    "promptReference": {
      "type": "object", "additionalProperties": false,
      "required": ["id", "version", "contentHash"],
      "properties": {
        "id": { "type": "string", "minLength": 1, "maxLength": 200 },
        "version": { "type": "string", "minLength": 1, "maxLength": 100 },
        "contentHash": { "$ref": "#/$defs/sha256String" }
      }
    },
    "reviewInputs": {
      "type": "object", "additionalProperties": false,
      "required": ["effectiveHash", "complete", "standards", "omitted", "prompt"],
      "properties": {
        "effectiveHash": { "$ref": "#/$defs/inputManifestHash" },
        "complete": { "type": "boolean" },
        "standards": { "type": "array", "items": { "$ref": "#/$defs/standardReference" } },
        "omitted": { "type": "array", "items": { "type": "string", "pattern": "^[a-z0-9][a-z0-9._-]{1,127}$" } },
        "prompt": { "$ref": "#/$defs/promptReference" }
      }
    },
    "grade": {
      "type": "object", "additionalProperties": false,
      "required": ["score", "band", "rationale"],
      "properties": {
        "score": { "type": "integer", "minimum": 0, "maximum": 100 },
        "band": { "enum": ["A", "B", "C", "D", "F"] },
        "rationale": { "type": "string", "minLength": 1, "maxLength": 2000 }
      },
      "oneOf": [
        { "properties": { "score": { "minimum": 90 }, "band": { "const": "A" } } },
        { "properties": { "score": { "minimum": 80, "maximum": 89 }, "band": { "const": "B" } } },
        { "properties": { "score": { "minimum": 70, "maximum": 79 }, "band": { "const": "C" } } },
        { "properties": { "score": { "minimum": 60, "maximum": 69 }, "band": { "const": "D" } } },
        { "properties": { "score": { "maximum": 59 }, "band": { "const": "F" } } }
      ]
    },
    "aspect": {
      "type": "object", "additionalProperties": false,
      "required": ["id", "title", "grade"],
      "properties": {
        "id": { "type": "string", "pattern": "^[a-z][a-z0-9.-]{1,63}$" },
        "title": { "type": "string", "minLength": 1, "maxLength": 200 },
        "grade": { "$ref": "#/$defs/grade" }
      }
    },
    "position": {
      "type": "object", "additionalProperties": false, "required": ["line", "column"],
      "properties": { "line": { "type": "integer", "minimum": 1 }, "column": { "type": "integer", "minimum": 1 } }
    },
    "range": {
      "type": "object", "additionalProperties": false, "required": ["start", "end"],
      "properties": { "start": { "$ref": "#/$defs/position" }, "end": { "$ref": "#/$defs/position" } }
    },
    "location": {
      "type": "object", "additionalProperties": false, "required": ["path"],
      "properties": {
        "path": { "$ref": "#/$defs/repoPath" },
        "range": { "$ref": "#/$defs/range" },
        "symbolId": { "type": "string", "minLength": 1, "maxLength": 2000 }
      }
    },
    "finding": {
      "type": "object", "additionalProperties": false,
      "required": ["id", "aspect", "severity", "title", "description", "recommendation", "locations"],
      "properties": {
        "id": { "type": "string", "pattern": "^[a-z][a-z0-9._-]{2,127}$" },
        "fingerprint": { "$ref": "#/$defs/sha256String" },
        "aspect": { "type": "string", "pattern": "^[a-z][a-z0-9.-]{1,63}$" },
        "severity": { "enum": ["critical", "high", "medium", "low", "info"] },
        "ruleId": { "type": "string", "minLength": 1, "maxLength": 200 },
        "title": { "type": "string", "minLength": 1, "maxLength": 300 },
        "description": { "type": "string", "minLength": 1, "maxLength": 10000 },
        "evidence": { "type": "string", "minLength": 1, "maxLength": 10000 },
        "recommendation": { "type": "string", "minLength": 1, "maxLength": 10000 },
        "locations": { "type": "array", "items": { "$ref": "#/$defs/location" } }
      }
    },
    "aggregateMember": {
      "type": "object", "additionalProperties": false, "required": ["unitId", "path", "subjectHash"],
      "properties": {
        "unitId": { "type": "string", "pattern": "^qs-v1/(angular|dotnet)/file/[a-f0-9]{64}$" },
        "path": { "$ref": "#/$defs/repoPath" },
        "subjectHash": { "$ref": "#/$defs/sha256String" }
      }
    },
    "exclusion": {
      "type": "object", "additionalProperties": false, "required": ["path", "reason"],
      "properties": {
        "path": { "$ref": "#/$defs/repoPath" },
        "reason": { "type": "string", "minLength": 1, "maxLength": 500 }
      }
    },
    "aggregate": {
      "type": "object", "additionalProperties": false, "required": ["members", "excluded"],
      "properties": {
        "members": { "type": "array", "uniqueItems": true, "items": { "$ref": "#/$defs/aggregateMember" } },
        "excluded": { "type": "array", "uniqueItems": true, "items": { "$ref": "#/$defs/exclusion" } }
      }
    }
  }
}
