{
  "$schema": "https://agent-orchestrator.dev/quality/schemas/review-meta.v1.schema.json",
  "schemaVersion": 1,
  "unit": {
    "id": "qs-v1/dotnet/file/2a73c6bf4fefcd9a4b4f2bb09436d8590b51f60b53b4a7b40b6cb3ad493ca527",
    "adapter": "dotnet",
    "level": "file",
    "path": "src/QualityStudio.Api/Program.cs",
    "displayName": "Program.cs"
  },
  "reviewedAt": "2026-07-21T11:19:21.5723824Z",
  "kind": "code",
  "reviewer": {
    "agent": "codex",
    "model": "runner-default",
    "runId": "quality-5364fc5051fb4e6ebb44b56a0aeffacd"
  },
  "reviewedHash": {
    "algorithm": "sha256",
    "canonicalization": "quality-studio-subject-manifest-v1",
    "value": "505d940074182d75241aa0c5f4b30dae9ec98c939531a0dccae641e42a794770"
  },
  "subjectInputs": [
    {
      "path": "src/QualityStudio.Api/Program.cs",
      "selector": "file",
      "contentHash": "sha256:83b6da05de4511308683a44b4f926573f0e133606c96aefc35c50adf375bc324"
    }
  ],
  "reviewInputs": {
    "effectiveHash": {
      "algorithm": "sha256",
      "canonicalization": "quality-studio-review-inputs-v1",
      "value": "ee3c91f413afa6601aa2fbd811b1021fb635a422325a6e95fb2f9754ea9f20c5"
    },
    "complete": true,
    "standards": [],
    "omitted": [],
    "prompt": {
      "id": "file-code-review",
      "version": "1.0.0",
      "contentHash": "sha256:a75bd42bb81dfc80d21e4abe8ed88ce3b7f08331641bb6f5adbe75335837f128"
    }
  },
  "grade": {
    "score": 76,
    "band": "C",
    "rationale": "The API composition is readable and uses consistent dependency injection, logging, cancellation tokens, and typed responses. However, broad exception classification can produce misleading responses, exception details may disclose internal information, file loading is unbounded, nullable scanner data is dereferenced unsafely, and the monolithic entry point limits focused testing."
  },
  "summary": "The implementation is generally coherent and operationally observable, but several edge cases can cause incorrect status codes, information disclosure, excessive memory consumption, or runtime failures. Extracting endpoint logic and centralizing error translation would materially improve maintainability and testability.",
  "aspects": [
    {
      "id": "correctness",
      "title": "Correctness",
      "grade": {
        "score": 74,
        "band": "C",
        "rationale": "Most endpoint workflows are straightforward, but unbounded file reads, unsafe assumptions about finding ranges, and incomplete line-ending detection leave meaningful correctness and reliability gaps."
      }
    },
    {
      "id": "maintainability",
      "title": "Maintainability",
      "grade": {
        "score": 78,
        "band": "C",
        "rationale": "Naming and organization are consistent, but Program.cs contains service composition, transport concerns, exception policy, mapping, file decoding, importing, and business workflows in one large file."
      }
    },
    {
      "id": "clarity",
      "title": "Clarity",
      "grade": {
        "score": 85,
        "band": "B",
        "rationale": "The code is generally easy to follow, with descriptive handler names, structured logging, and concise endpoint mappings. A few centralized policies hide overly broad assumptions about exception origins."
      }
    },
    {
      "id": "error_handling",
      "title": "Error Handling",
      "grade": {
        "score": 68,
        "band": "D",
        "rationale": "A central problem-details handler is valuable, but it classifies broad framework exception types by presumed origin and returns raw exception messages to clients."
      }
    },
    {
      "id": "testability",
      "title": "Testability",
      "grade": {
        "score": 70,
        "band": "C",
        "rationale": "The public partial Program supports integration testing, but private static handlers, static filesystem operations, and concrete dependencies make isolated tests unnecessarily difficult."
      }
    }
  ],
  "findings": [
    {
      "id": "QS-PROGRAM-001",
      "aspect": "error_handling",
      "severity": "medium",
      "title": "Broad exception types are mapped to unrelated domain errors",
      "description": "Every ArgumentException is reported as an invalid repository path and every InvalidOperationException as an unavailable Agent Studio target. These exceptions can originate from serialization, configuration, framework code, or unrelated services, causing misleading 400 or 503 responses and potentially concealing server defects.",
      "recommendation": "Map explicit domain exception types at the boundary that owns each failure. Allow unexpected ArgumentException and InvalidOperationException instances to fall through to the generic 500 response, or translate them locally where their meaning is known.",
      "locations": [
        {
          "path": "src/QualityStudio.Api/Program.cs",
          "range": {
            "start": {
              "line": 45,
              "column": 5
            },
            "end": {
              "line": 57,
              "column": 89
            }
          }
        }
      ]
    },
    {
      "id": "QS-PROGRAM-002",
      "aspect": "error_handling",
      "severity": "medium",
      "title": "Raw exception messages are exposed to API clients",
      "description": "The problem response includes exception.Message for both expected and unexpected failures. Messages from filesystem, HTTP, configuration, and registry operations can reveal local paths, remote targets, or implementation details.",
      "recommendation": "Return stable, client-safe details for anticipated domain failures and omit detail for unexpected exceptions. Preserve the complete exception only in structured server logs, optionally attaching a correlation identifier to the response.",
      "locations": [
        {
          "path": "src/QualityStudio.Api/Program.cs",
          "range": {
            "start": {
              "line": 61,
              "column": 5
            },
            "end": {
              "line": 61,
              "column": 107
            }
          }
        }
      ]
    },
    {
      "id": "QS-PROGRAM-003",
      "aspect": "correctness",
      "severity": "medium",
      "title": "File endpoint loads files into memory without a size limit",
      "description": "File.ReadAllBytesAsync allocates an array for the entire selected file and the response subsequently creates a decoded string as well. A large repository artifact can therefore consume roughly multiple times its file size and may trigger excessive garbage collection or an out-of-memory process failure.",
      "recommendation": "Check file length against a configurable maximum before reading and return 413 Payload Too Large when exceeded. If large files must be supported, stream them or decode incrementally with an explicit response-size policy.",
      "locations": [
        {
          "path": "src/QualityStudio.Api/Program.cs",
          "range": {
            "start": {
              "line": 148,
              "column": 5
            },
            "end": {
              "line": 150,
              "column": 59
            }
          }
        }
      ]
    },
    {
      "id": "QS-PROGRAM-004",
      "aspect": "correctness",
      "severity": "medium",
      "title": "Security finding mapping dereferences a nullable range",
      "description": "The null-forgiving operator on location.Range suppresses compiler analysis but does not prevent a runtime NullReferenceException. The subsequent range accesses are also unguarded, so any scanner result without positional information makes the entire security-scan response fail.",
      "recommendation": "Validate scanner output before mapping or make the response range nullable and map absent ranges explicitly. If ranges are a required invariant, enforce that invariant when constructing SecurityFindingLocation and fail with a targeted domain error.",
      "locations": [
        {
          "path": "src/QualityStudio.Api/Program.cs",
          "range": {
            "start": {
              "line": 473,
              "column": 9
            },
            "end": {
              "line": 477,
              "column": 98
            }
          }
        }
      ]
    },
    {
      "id": "QS-PROGRAM-005",
      "aspect": "correctness",
      "severity": "low",
      "title": "Line-ending detection labels unsupported cases as LF",
      "description": "The detector only examines newline characters. Content with no line terminator or with legacy lone carriage returns is reported as \u0022lf\u0022, even though no LF line ending exists. This makes the FileResponse metadata inaccurate for valid edge-case files.",
      "recommendation": "Distinguish \u0022none\u0022, \u0022cr\u0022, \u0022lf\u0022, \u0022crlf\u0022, and \u0022mixed\u0022, or clearly define and implement a documented fallback value for files without recognized line endings.",
      "locations": [
        {
          "path": "src/QualityStudio.Api/Program.cs",
          "range": {
            "start": {
              "line": 178,
              "column": 1
            },
            "end": {
              "line": 188,
              "column": 77
            }
          }
        }
      ]
    },
    {
      "id": "QS-PROGRAM-006",
      "aspect": "testability",
      "severity": "low",
      "title": "Endpoint workflows are embedded as private static methods in Program",
      "description": "Repository resolution, filesystem access, importing, response mapping, and endpoint orchestration are implemented as private static methods in the application entry point. They can primarily be exercised through full-host integration tests, making edge cases slower and harder to isolate.",